id	severity	finding	evidence
weak_tracking_teacher	high	The current strongest local PPO teachers still have low reward and high done/termination rates; downstream VAE/diffusion can only imitate this weak behavior.	scaled_ppo_iter999 reward_mean=0.0242308 done_rate=0.998841; scaled PPO termination diagnostic dominant component=ee_body_pos fraction=0.998841
endpoint_body_semantics	high	Endpoint z-only body-position termination dominates or remains a major failure source. Relaxing the endpoint threshold improves done rate but changes the evaluator and does not repair paper-level tracking.	threshold_sweep best_threshold=0.5, best_done_rate=0.0890762, why_not_paper_level=Changing the termination threshold changes the evaluator, so these rows are diagnostics only and cannot be reported as official BeyondMimic tracking scores.
mujoco_native_adapter_missing	high	The native MuJoCo 160-D IsaacLab-compatible observation/action adapter is not complete, so the IsaacLab PPO checkpoint cannot be honestly claimed as a MuJoCo closed-loop policy.	adapter_gap checks native_mujoco_adapter_complete=False; actor input/output dimensions are 160/29.
pd_root_assist_video_boundary	medium	The current MuJoCo control videos use PD target tracking plus root-assist external forces; they are useful diagnostics but not learned unassisted humanoid control.	all current control rows mark native_mujoco_ppo_obs_adapter=False; most controller rows use_root_assist_controller=True.
missing_official_level_c_artifacts	medium	Official BeyondMimic VAE/diffusion checkpoints, true DAgger rollout logs, paper-level Fig.5/Fig.6 videos, TensorRT engine, and real-robot evidence remain absent.	The workspace contains reference-project ONNX/PT/GIF assets and many debug NPZ artifacts, but it does not contain the required official/teacher-rollout BeyondMimic tracking/VAE/diffusion checkpoints, TensorRT engine, closed-loop rollout logs, Fig.5/Fig.6 artifacts, or reproduced success/failure videos. It does contain one public-LAFAN1 paper-architecture VAE/diffusion checkpoint, which is recorded separately and must not be counted as an official DAgger/closed-loop paper checkpoint. It also contains resource-adjusted G1 PPO checkpoints, which prove local virtual training execution but are separately excluded from official paper-level tracking artifacts. The resource-adjusted teacher-rollout and official-importer-export PPO checkpoints are also separately excluded from official paper-level tracking artifacts. The resource-adjusted teacher-rollout VAE checkpoint and state-latent denoiser checkpoint are also separately classified as local evidence rather than official DAgger/VAE/diffusion artifacts, including the newer scaled PPO official-importer-export VAE and denoiser checkpoints. A local kinematic reference MP4 is present for reporting, but it is excluded from paper-level closed-loop/video evidence.
